{
  "schema": "stpd/developer-combination-v1",
  "platform_repository": "https://github.com/rsgcsg/STS2-AI-PLATFORM.git",
  "platform_source_revision": "79fdb2b186bb9cc8a76ddc6a1b00c2493c6916fb",
  "evidence_source_revision": "79fdb2b186bb9cc8a76ddc6a1b00c2493c6916fb",
  "policy_mode": "existing-adapter-only",
  "node_packages": [
    {
      "package": "@rsgcsg/sts2-host-runtime",
      "version": "1.1.0-rc.7",
      "source_revision": "dce2c26c0accb0bbbe435191ca371aee9725fa48",
      "component_tree_revision": "c5a0beb062a2f402a64c26ed21eb3a01b2613688",
      "release_asset_sha256": "b77fb7956caabb3b43ac03c0aee78c9918ce852cee819c6ca44cf77671743f20",
      "package_content_sha256": "abb4dcb0627e74db48ec0e6c10e1bd2fb53d08215ae5fea581bc991e55d35585"
    },
    {
      "package": "@rsgcsg/sts2-connector-client",
      "version": "1.1.0-rc.1",
      "source_revision": "d2dfdf8473c39428a9d51f9aa7ba99a0b3b05ff7",
      "component_tree_revision": "eedd39302cdab2b8a324ecc27c6d16a8cfbb67ee",
      "release_asset_sha256": "4484b4bec90f43c29c108fe5444e419c8a81164fb4b246ac3212c51960db1ed3",
      "package_content_sha256": "d3ac14b13f16aea3cd07045475036afe8ac3751ef1add63c4b233a59c5655153"
    }
  ]
}
